{
  "event_id": "01a0b1c2-4a13-7d09-b8e1-2f0a3b4c5d6e",
  "event_type": "SESSION_OPENED",
  "schema_version": 1,
  "world_id": "01a0b1c2-3d4e-7f01-8a2b-9c0d1e2f3a4b",
  "tick": 1200,
  "sequence": 0,
  "occurred_at": "3800-01-01T01:00:00Z",
  "recorded_at": "2026-09-18T13:04:22.417Z",
  "correlation_id": "01a0b1c2-4a12-7c01-8d02-1e033f044a05",
  "causation_id": null,
  "actor_id": "01a0b1c2-2c01-7a45-8b67-89abcdef0123",
  "payload": {
    "session_id": "01a0b1c2-4a11-7b22-9c33-0d44e55f6a77",
    "transport": "WEBSOCKET"
  }
}
